sentiment,text,char_count,word_count,label
neutral,"The Board of Directors proposes to the Shareholders ' Meeting on 18 March 2010 that the company would pay dividend for the financial year January 1 - December 31 , 2009 , EUR 0.02 per share .",191,37,1
negative,"Managing Director 's comments : `` Net sales for the first quarter were notably lower than a year before , especially in Finland , Russia and the Baltic countries .",164,30,0
neutral,Liora 's got a brand-new bag .,30,7,1
neutral,"According to Finnish Scanfil 's founder and chairman of the board , Jorma J. Takanen , the company has to look for growth abroad .",130,25,1
positive,"`` The transaction strengthens our position ... in design and branded goods , '' said Fiskars president and CEO Heikki Allonen , pointing out that the two groups have relatively few overlapping operations .",206,34,2
neutral,VNH generates annual net sales of about 5 mln eur and employs 21 people .,73,15,1
neutral,"Body ES Vostok also owns stakes in power sales companies MosenergosbytBody ( RTS : MSSB ) ( 50.9 % ) , Altaienergosbyt ( 100 % ) , Saratovenergo ( RTS : SARE ) Body ( 48.36 % ) and Tambov Power Sales Company ( RTS : TASB ) ( 49.01 % ) , all ofBodywhich it received from the distribution balance .",296,62,1
neutral,"The scheme for TeliaSonera and Altimo is practically identical , except that it involves the merger of their stakes in VimpelCom and Kyivstar .",143,24,1
positive,Altia 's operating profit jumped to EUR 47 million from EUR 6.6 million .,73,14,2
negative,"In Finland , snow storms brought trees down on power lines , cutting off electricity for some 2,000 households .",112,20,0
neutral,"In Finland , 71 % of paper and paperboard is reclaimed .",56,12,1
negative,"Operating profit for the 12-month period decreased from EUR157 .5 m , while net sales increased from EUR634 .3 m , as compared to 2007 .",136,26,0
neutral,The devices also contains Finnair 's own application for compiling customer feed-back and ideas for product development .,121,18,1
neutral,Pharmaceuticals - Italy This brand-new market analysis gives a clear overview of the actual situation and future outlook of the pharmaceutical market in Italy .,160,25,1
neutral,Finnish plastic pipe maker Uponor is selling its Irish and UK infrastructure businesses to private equity company 3i .,118,19,1
neutral,- Cash flow from operating activities before investments was EUR 0.8 -1.2 million .,83,14,1
negative,The number of bodily injury cases quadrupled in 2000-2006 .,59,10,0
neutral,Automation makes it possible to conduct several tests simultaneously .,70,10,1
negative,"The Baltimore Police and Fire Pension , which has about $ 1.5 billion , lost about $ 3.5 million in Madoff Ponzi scheme .",121,24,0
neutral,The company said that it has agreed to a EUR160m unsecured credit line from lenders .,85,16,1
negative,"However , the orders received during the period under review fell by 17 % quarter-on-quarter from the EUR 213 million recorded in the second quarter of 2010 .",158,28,0
positive,Cash flow from business operations totalled EUR 0.4 mn compared to a negative EUR 15.5 mn in the first half of 2008 .,117,23,2
positive,The Finnish group anticipates a sales gain of EUR42m after tax and expenses .,77,14,2
negative,"Net sales of the Paper segment decreased to EUR 221.6 mn in the second quarter of 2009 from EUR 241.1 mn in the second quarter of 2008 , while operating profit excluding non-recurring items rose to EUR 8.0 mn from EUR 7.6 mn .",226,44,0
negative,"In July-September 2009 , Konecranes ' sales decreased to EUR 368.7 mn from EUR 520.4 mn in July-September 2008 .",112,20,0
neutral,It is estimated that the consolidated turnover of Kausta Guder will reach Lt 53mn US$ 22.53 mn EUR 15.35 mn in 2007 .,117,23,1
negative,"Last year , 8.3 million passengers flew the airline , down 4 percent from 2007 .",80,16,0
neutral,"Boomeranger Boats Oy specialises in boat building and designs , manufactures and sells customised Rigid Inflatable Boats RIB primarily for the Baltic Sea market .",162,25,1
neutral,"The redesigned crushing circuit has been in operation since the start of September and its overall production rate on a weekly basis is in excess of an average of 40,000 tonnes a day .",184,34,1
positive,The executive group will participate in the adjustments with a fixed-term 5 % salary cut .,90,16,2
positive,"Quarterly diluted EPS on continuing operations came in at 0.21 eur , compared with last year 's 0.12 eur .",106,20,2
neutral,Nokia said the outcome was a `` fair and responsible social plan . '',69,14,1
positive,Finnish construction group Lemmink+Æinen has been awarded two road building contracts by the Lithuanian transport administration .,130,17,2
neutral,It has several innovative small molecule and biological drug candidates at different stages of clinical development .,117,17,1
neutral,1 April 2011 - Finnish machinery rental company Ramirent Oyj HEL : RMR1V said today it has acquired the assets of sector player Stavebni Doprava a Mechanizace SDM in the Czech Republic for an undisclosed sum .,209,37,1
neutral,"Okmetic has a global customer base and sales network , production plants in Finland and the US and contract manufacturers in Japan and China .",142,25,1
positive,"In addition to fireplace exports , demand for lining stone has exceeded the level of the earlier part of the year and will continue to be clearly brisker for the remainder of the year .",185,35,2
neutral,"After buying Eukor Car Carriers 50 percent stake , Grimaldi Group is now the sole owner of the Swedish roll-on , roll-off port of Wallhamn .",140,26,1
positive,"Finnish steel maker Rautaruukki Oyj ( Ruukki ) said on July 7 , 2008 that it won a 9.0 mln euro ( $ 14.1 mln ) contract to supply and install steel superstructures for Partihallsforbindelsen bridge project in Gothenburg , western Sweden .",238,43,2
neutral,"The E7 smartphone will be available for Rs35 ,000 per handset across India , '' Nokia India vice-president & managing director D Shivakumar told reporters .",156,26,1
neutral,"The third applicant , Fortum , was dropped .",44,9,1
neutral,"Depending on the market situation , such projects are sold after 1 to 3 years after completion .",96,18,1
neutral,"NORDIC BUSINESS REPORT-17 January 2006-Efore Plc inaugurates new plant in Estonia -_ 1998-2006 M2 COMMUNICATIONS LTD Finnish power electronics manufacturer Efore Plc said on Tuesday ( 17 January ) that it was inaugurating its new plant in Parnu , Estonia .",256,41,1
neutral,Rimi supermarket is the key customer in Magistral center .,58,10,1
neutral,"Poyry Energy GmbH is Austria 's leading engineering and consulting company in the energy , infrastructure and environment sector , owned by Poyry Plc. and the Austrian Verbund AG .",180,30,1
neutral,Finnish construction company YIT HEL : YTY1V said it had agreed to take over German facility engineering and facility systems firm Caverion for EUR73m USD90 .3 m .,163,28,1
neutral,Antniemi refuted a report by the Finnish daily Turun Sanomat as if the company was reorganizing its operations in the Baltic countries .,136,23,1
neutral,"In 2008 , Kemira recorded revenue of approximately EUR 2.8 billion and had a staff of 9,400 .",93,18,1
neutral,Mr K.R. Vasantha has been appointed Managing Director of Incap Contract Manufacturing Services Pvt. Ltd. .,106,16,1
negative,EB announced in its stock exchange release on November 18th 2008 that J.T. Bergqvist has resigned from the chairmanship and membership of the Board of EB .,155,27,0
neutral,Both Mr Walden and Mr Ignatius will be responsible also for the newspapers ' business result .,94,17,1
positive,"The growth in the activeness of Talentum 's customers , which started at the end of 2009 , continued during the reporting period , the company stated .",151,28,2
positive,The aim is to achieve EUR 2.5 mn yearly savings .,49,11,2
neutral,"After the restructuring , UPM 's average paper machine capacity in Europe will be 320,000 tons ( 350,000 short tons ) in coated magazine paper and 420,000 tons ( 460,000 short tons ) in coated fine paper .",205,38,1
neutral,Finnish forestry company UPM-Kymmene and waste management company Lassila & Tikanoja said on Jan. 30 they were planning to produce ethanol and energy from commercial and industrial waste .,188,29,1
neutral,"CapMan 's first real estate fund , which had a total investment capacity of ( EURO ) 500 million and closed in June 2005 , invested in commercial properties in the Helsinki metropolitan area .",192,35,1
neutral,Today the orange scissors are the iconic symbol of the excellent ergonomic design and superior quality associated with every product from Fiskars .,147,23,1
positive,"The company is now intensifying its smelter operations and increasing its annual production capacity to 230,000 tonnes of copper .",130,20,2
positive,HELSINKI AFX - Outokumpu said its technology unit has won a 28 mln eur contract from Bosnia-Herzegovina 's Aluminij dd Mostar to upgrade an anode plant .,153,27,2
neutral,"ALEXANDRIA , Va. , Oct. 6 -- United States Patent no. 7,804,288 , issued on Sept. 28 , was assigned to Vacon Oyj ( Vaasa , Finland ) .",134,29,1
positive,The social plan negotiations were part of the three year turn-around program which is expected to ensure Salomon 's future competitiveness .,140,22,2
neutral,"Paper company M-real calculated that if 100,000 biscuit cartons are made using a 25gsm lighter board , the CO2 saved over the course of 12 months would be equal to that generated by driving 1,000 km by car .",207,39,1
positive,"Section : Regional News - The demand in Finnair 's Asian traffic , measured in passenger kilometers , was up 34.9 % in August compare to last year .",148,29,2
neutral,The carrier said its Area travel agency is to sell most of its outlets to sister chain Suomen Matkatoimisto (SMT)and use its remaining bricks-and-mortar presence to primarily target business customers going forward .,216,33,1
neutral,CapMan made its initial investment in OneMed in June 2006 .,59,11,1
negative,"Nokia shares hit 13.21 euros on Friday , down 50 percent from the start of the year in part because of the slow introduction of touch-screen models .",149,28,0
neutral,Finnish department store group Stockmann is planning to acquire about EUR 141mn through a directed issue and a rights offering .,128,21,1
neutral,The objective of the St. Petersburg office is first to boost the Company 's maintenance business .,98,17,1
positive,"EBITDA for the year 2009 improved to EUR484m , as compared with EUR472m in 2008 .",81,16,2
positive,Finnish metal components supplier Componenta Oyj said its net profit went up to 3.5 mln euro $ 4.5 mln in 2006 from 2.2 mln euro $ 2.8 mln in 2005 .,148,31,2
neutral,Vacon recently announced plans to build its North American headquarters at 5 Business Park in Chambersburg .,108,17,1
negative,"Operating profit totalled EUR 30.2 mn , down from EUR 43.8 mn a year earlier .",78,16,0
neutral,"Mr. Mika Korpinen , APAC Vice President for Comptel concludes : `` Comptel is once again demonstrating the importance of providing reliable delivery and enabling time-to-market .",178,27,1
neutral,"Elisa Corporation , headquartered in Helsinki , is a Finnish telecomms company offering private and corporate customers a comprehensive range of telecomms services .",165,24,1
neutral,Absolut Bank is exploring the possibility of further borrowing .,64,10,1
neutral,"Altona stated that the private company of Altona chairman Kevin Maloney , Tulla Resources , would take up its entitlement in full .",131,23,1
negative,17 March 2011 - Goldman Sachs estimates that there are negative prospects for the Norwegian mobile operations of Norway 's Telenor ASA OSL : TEL and Sweden 's TeliaSonera AB STO : TLSN in the short term .,204,38,0
neutral,"Tyrvaan Sanomat , published twice a week by Tyrvaan Sanomat Oy , appears in Sastamala and Kiikoinen .",101,18,1
positive,"`` Overall , we 're pleased with the startup curve ... and we 're pleased with the quality of the paper , '' Stora spokeswoman Patricia Dietz said Tuesday .",156,30,2
neutral,"`` We have a group of 120 volunteers made up of Digicel employees who will manage the distribution ... Over the next week , they will distribute the 19,000 tents to more than 150 organizations , '' Digicel Haiti CEO Maarten Boute said .",236,44,1
neutral,"Supported Nokia phones include : N96 , N95-8GB , N95 , N93-N931 , N92 , N85 , N82 , N81 , N80 , N79 , N78 , N77 , N76 , N75 , N73 , N72 , N71 , E90 , E71 , E70 , E66 , E65 , E62 , E61-E61i , E60 , E51 , E50 , Touch Xpress 5800 , 6220 Classic , 6210 Navigator , 6120 Classic , 6110 Navigator , 5700 , 5500 , 5320XM .",315,81,1
negative,"Operating profit totalled EUR 9.0 mn , down from EUR 9.7 mn in the first half of 2008 .",87,19,0
neutral,"Besides , Pit-Produkt will enter the new segments .",51,9,1
positive,21 October 2010 - Finnish fishing tackle company Rapala VMC Corp ( HEL : RAP1V ) said today its net profit rose to EUR18 .9 m for the first nine months of 2010 from EUR15 .1 m for the same period a year earlier .,212,45,2
neutral,"Ahlstrom Corporation Anne Pirila Director , Financial communications Distribution : Helsinki Stock Exchange Main media Ahlstrom in brief Ahlstrom is a leader in the development , manufacture and marketing of high performance fiber-based materials .",248,35,1
positive,Operating profit improved by 39.9 % to EUR 18.0 mn from EUR12 .8 mn .,69,15,2
neutral,15 September 2010 - Finnish electrical components maker Salcomp Oyj ( HEL : SAL1V ) announced today the launch of its latest Twist charger platform .,149,26,1
positive,The company plans to expand into the international market through its subsidiaries and distributors from 2011 onwards .,119,18,2
positive,Affecto expects its net sales for the whole 2010 to increase from the 2009 level when they reached EUR 103 million .,116,22,2
positive,"The company said that its investments in the new market areas resulted in sales increase in Sweden , Poland , Russia and Lithuania .",132,24,2
neutral,"The company operates its business through two reportable segments , including Banking and Investment Services , and Non-Life Insurance .",136,20,1
negative,The administrators have indicated a need for 900 job cuts at the Irish insurer over the next 15 months .,104,20,0
neutral,"After the transaction , Danske Bank becomes an equal player with Nordic bank group Nordea in the Nordic countries .",115,20,1
positive,"Excluding non-recurring items , pre-tax profit surged 45 % to EUR80m .",70,12,2
positive,Paper maker Stora Enso Oyj said Friday it has been acquitted of charges that it participated in a paper price-fixing conspiracy in the United States .,150,26,2
neutral,"Bids or offers include at least 1,000 shares and the value of the shares must correspond to at least EUR4 ,000 .",112,22,1
neutral,The order was valued at over EUR15m .,37,8,1
neutral,Two of these contracts are for turntable anode vibrocompactors that will be delivered to Gansu Hualu Aluminum Co Ltd and another unnamed costumer .,147,24,1
neutral,"The end-to-end delivery combines the competencies and services from TietoEnators Telecom & Media , Processing & Network and Digital Innovations Business Areas .",160,23,1
neutral,Affecto has helped SKAT to set up the platform and has previously delivered several Business Intelligence projects for SKAT .,125,20,1
positive,"Under the agreement GeoSentric will provide GyPSii-powered hotel information and reservation services to visitors to China , including such popular cities as Beijing and Shanghai .",180,26,2
neutral,Cameco is to provide an upfront investment of up to USD 60mn for the construction of the uranium extraction circuit .,117,21,1
neutral,"In January-September 2007 , operating profit totaled EUR 20.5 mn .",66,11,1
neutral,"The sale will be finalized in September or October , the company said .",71,14,1
neutral,In 2005 Cargotec 's net sales exceeded EUR 2.3 billion .,56,11,1
neutral,"The new Kroksberg railway tunnel will be built on a new section of track between Harnosand and Veda , forming part of the line that follows the coast of the Gulf of Bothnia .",174,34,1
neutral,Decisions are to be made as quickly as possible .,49,10,1
negative,"In the Baltic countries , sales fell by 42.6 % .",48,11,0
neutral,"The contract covers the manufacturing , surface-treatment and installation of the steel structures .",100,14,1
positive,The company expects net sales to significantly increase from 2009 .,67,11,2
positive,"There has been some recovery of the base metals prices and increased demand for metals in China , however .",107,20,2
neutral,"The NTSB said investigators are set to conduct sight distance tests on July 18 , using trains similar to those involved in the accident .",137,25,1
negative,The number of salaried employees and group administration employees to be dismissed from the Sievi units is 17 .,112,19,0
positive,"Finnair PLC carried a record 8.8 million passengers in 2006 , an increase of 3.5 percent on the previous year , the Finnish national carrier reported Tuesday .",159,28,2
neutral,The Estonian parliament was set to vote on amendments to the excise duty law on Wednesday that would add 0.42 kroons to the price of a liter of diesel and 0.45 kroons to the price of a liter of gasoline from the start of 2010 .,227,46,1
neutral,He is resting comfortably and is looking forward to getting back to work . '',77,15,1
neutral,"The bond , with a maturity of five years , is part of the bank 's domestic bond program .",89,20,1
positive,The pipeline is strong .,24,5,2
positive,Ramirent s Danish subsidiary Ramirent A-S has today signed an agreement to acquire the business assets of the machinery rental company Jydsk Materiel Udlejning located in West Jutland .,185,29,2
positive,Stora Enso owns 43 percent of Bergvik and earns therefore SEK 1.5 bn on the value appreciation .,96,18,2
positive,"Sales improved to SEK 1,553 mn , compared with SEK 1,408 mn .",61,13,2
neutral,The restructuring measures will not affect the production of packaging printing material .,90,13,1
positive,A & euro ; 4.8 million investment in 13.6 % of Lewa netted Deutsche Beteiligungs & euro ; 21 million .,102,21,2
positive,"`` They would invest not only in the physical infrastructure , but would also provide know-how for managing and developing science and technology parks , '' said Sunrise Valley director Andrius Bagdonas .",204,33,2
negative,Revenue in the quarter fell 8 percent to ( EURO ) 2.4 billion compared to a year earlier .,90,19,0
neutral,Other details were not provided .,33,6,1
negative,"Antti Orkola , president of Kemira GrowHow 's Industrial Solutions unit , told Thomson Financial News the company has put off opening the mine as prices of phosphate have been ` quite depressed for a long time ' . '",215,40,0
positive,"In addition to the Indian market , the new plant will serve Salcomp 's customers globally , the company said .",110,21,2
neutral,"Regulatory News : The Nomination Committee of Cybercom ( STO : CYBE ) , which is unanimous in its proposal , proposes the election of Jon Risfelt as the new Chairman of the Board .",180,35,1
neutral,"It operates under three distinct brands : United Supermarkets , Market Street and United Supermercado .",103,16,1
positive,"With the measures , Suominen Corporation aims to ensure the competitiveness of the Flexible Packaging business in the long term .",129,21,2
neutral,Raffles Equities Ltd became a substantial holder in Archer Exploration Ltd on January 12 with 11.7 million shares ( 18.2 pc ) .,127,23,1
positive,"The seminar introduced modern , clean technologies and products , financial tools and sponsorship programs for energy and environment projects as well as the potential to develop clean energy in Vietnam .",204,32,2
neutral,Pohjola and cooperative banks have continued to combine their branch office network .,85,13,1
neutral,The Group 's revenue in 2009 amounted to EUR 70 million and the company currently employs approximately 780 people .,116,20,1
neutral,"Finland-based companies , L+Ænnen Tehtaat and Raisio , have decided to dissolve the joint venture company ZAO Scandic Feed , which was established to start local animal feed business and feed production in northwest Russia .",224,36,1
neutral,"Tieto 's service is also used to send , process and receive materials related to absentee voting .",98,18,1
neutral,Finnish paints and coatings company Tikkurila Oyj ( HEL : TIK1V ) announced today the launch of Tikkurila ProHouse method for protection of wooden surfaces via treatment with Ultra Pro waterborne products .,206,33,1
neutral,"The companies will divest to UPM Fray Bentos pulp mill and Forestal Oriental , a company specialising in eucalyptus cultivation .",129,21,1
positive,Olvi expects sales and market share to increase in the first quarter of 2010 .,78,15,2
neutral,"The total investment necessary will be EUR40m , the company estimated .",71,12,1
positive,The economic occupancy rate of Sponda 's property portfolio rose to 91.2 % from 88.8 % in 2006 .,96,19,2
neutral,Latvia 's Stockmann shopping mall is a subsidiary of Finland 's Stockmann Plc. .,80,14,1
neutral,"There are currently some ten shops selling Tikkurila 's paints in Kazakhstan , and more shops will be opened continuously .",123,21,1
positive,"On the other hand , Montevideo said that having the two mills working in the area will generate jobs .",102,20,2
negative,"As a result of these transactions , the aggregate holdings of Burrill Life Sciences Capital Fund , L.P. has decreased below 5 per cent of the total number of shares and votes of the Company .",191,36,0
neutral,Technopolis 's technological centers supply their clients with modern high-class premises .,91,12,1
negative,The total capital of funds managed by the bank decreased by 28 % to EUR 284mn by the end of September 2008 .,108,23,0
negative,"Finnish Bank of +_land reports operating profit of EUR 2.2 mn in the first quarter of 2010 , down from EUR 6.3 mn in the corresponding period in 2009 .",151,30,0
neutral,FCC Chairman Kevin Martin said that fair play required extending the same deregulatory rules to the digital subscriber lines that telecom providers use for broadband networks .,176,27,1
positive,"Both operating profit and turnover for the six-month period increased , respectively from EUR0 .1 m and EUR29 .0 m , as compared to the corresponding period a year ago .",169,31,2
neutral,"LONDON ( AFX ) - Intertek Group PLC , a testing and inspection company , said its commercial and electrical division has bought Finland-based company Natlabs Oy from Etteplan Oyj for 1.3 mln eur in cash .",204,37,1
negative,"Operating profit excluding non-recurring items decreased to EUR 6.2 mn from EUR 16.8 mn in 2007 , representing 2.3 % of net sales .",131,24,0
neutral,Kalmar Espana generated net sales of some 11.3 mln euro $ 14.8 mln in 2005 .,76,16,1
negative,"In addition , a further 29 employees can be laid off until further notice and the whole workforce can be laid off for short periods if needed .",143,28,0
positive,Hearst will be able to consolidate about 20 % of all Russian market for advertising in press after the purchase .,113,21,2
positive,"Investors will continue being interested in the company 's share although it is not quite cheap , Affarsvarlden said .",118,20,2
negative,"In Sweden , there is an oversupply of pharmacies .",50,10,0
positive,This new partnership agreement represents a significant milestone for both parties .,84,12,2
negative,"Since the association 's data do not cover sales figures from about 100 small local breweries and sales of imported beer products , the actual market shares of its members are smaller than those given in the report .",216,39,0
negative,Hobby Hall 's sales decrease 26 pct due to implementing a new information system that involved changing in the principal of posting sales .,139,24,0
neutral,"With this acquisition the wireless modem unit and its approximately 1,100 employees were transferred to Renesas Electronics Corporation .",137,19,1
neutral,"Following the payment made in April , the company has a total of EUR 23.0 million in loans from financial institutions .",120,22,1
positive,"Shares of Standard Chartered ( STAN ) rose 1.2 % in the FTSE 100 , while Royal Bank of Scotland ( RBS ) shares rose 2 % and Barclays shares ( BARC ) ( BCS ) were up 1.7 % .",172,41,2
neutral,"Financial , strategic and operational factors are considered .",62,9,1
neutral,L&T also acquired a 50 pct stake in local sector company Salvor Oy at the beginning of September 2007 .,103,20,1
neutral,Pharmaceuticals - Poland This brand-new market analysis gives a clear overview of the actual situation and future outlook of the pharmaceutical market in Poland .,162,25,1
positive,Finnish lifting equipment maker Konecranes HEL : KCR1V said on 29 July 2009 it has raised its stake in Austrian manipulator maker ACS Konecranes to 80 % and bought German sector player Knight Europe .,200,35,2
negative,The employment contracts of 14 of the employees will end in March 2009 as a result of the company 's previous employer-employee talks .,135,24,0
neutral,"Deutsche Beteiligungs , as well as a private equity fund it manages , first bought 75 % of MCE in a secondary buyout from White Plains , N.Y. , financial investor Andlinger & Co. in 2007 .",188,37,1
neutral,"The chain has been trying to cut its own costs , pressuring vendors such as fitness equipment manufacturer Precor to slash prices .",131,23,1
neutral,"Sarantel , based in Wellingborough , UK , designs high-performance antennas for portable wireless devices .",107,16,1
neutral,"Like all other mechanical pipettors from Biohit , also Proline Plus is CE-IVD marked and comes with a 3-year warranty .",119,21,1
negative,"ADPnews - Aug 3 , 2009 - Finnish media group Ilkka-Yhtyma Oyj HEL : ILK2S said today its net profit fell 45 % on the year to EUR 5.9 million USD 8.4 m in the first half of 2009 .",178,40,0
