sentiment,text,char_count,word_count,label
neutral,"At some point in 2010 , all separate company names , such as Palmberg , Tekmanni , Lemcon , Forssan Betoni , Suonenjoen Betonituote , among others , will disappear .",165,31,1
positive,The company said it observed a current stabilisation in prices and there is potential for higher prices for deliveries in the first quarter of 2011 .,149,26,2
neutral,More than 80 special events in the three counties during four months were hosted by the library system and its nine branch libraries .,134,24,1
neutral,- The Group - s result before taxes was a loss of EUR 0.6 ( +0.6 ) million .,77,19,1
neutral,Protalix has $ 42 million in cash and no sales .,48,11,1
positive,"In the end of 2006 , the number of outlets will rise to 60-70 .",63,15,2
neutral,Temporary layoffs in these units have already started .,55,9,1
positive,Loss after taxes amounted to EUR 1.2 mn compared to a loss of 2.6 mn .,70,16,2
neutral,Storengy is the GDF SUEZ company that is dedicated to the underground storage of natural gas .,94,17,1
neutral,"8,600 m , and at the time of investment it is fully leased to several tenants .",79,17,1
neutral,Panostaja did not disclose the purchase price .,47,8,1
negative,"At 12.01 pm , the OMX Helsinki 25 was down 0.66 pct to 3,143.57 and the OMX Helsinki was 0.67 pct lower at 10,530.74 on 253 mln eur turnover .",142,30,0
positive,"According to A-Rehu 's Managing Director , Jouko Lahtinen , the project will stabilise costs and improve supply security .",122,20,2
neutral,It is the first application in the market for invoice and purchase requisition approval with a mobile device .,110,19,1
neutral,SWOT analysis is just one method of categorization and has its own weaknesses .,79,14,1
neutral,Aldata said that there are still a number of operational aspects to be defined between it and Microsoft and further details of the product and market initiatives resulting from this agreement will be available at a later date .,227,39,1
neutral,Finnlines said that the deal is part of its strategy to focus on its core businesses .,86,17,1
neutral,"The major part of the deliveries include different AC and CXE amplifier solutions and products by DINH Telecom , a company acquired by Teleste last spring .",156,27,1
neutral,The EA Reng group posted sales of approximately 84 million kroons for 2007 .,76,14,1
neutral,LSC 's 30 employees will move to Ixonos with their existing status and benefits .,81,15,1
neutral,"Aldata Solution , a global company engaged in supplier to consumer business process optimization , has announced the details of its Dollars for Dinosaurs program .",163,26,1
neutral,Protalix is developing genetically engineered proteins from plant cells .,73,10,1
negative,"Additionally , the company will terminate a maximum nine salaried and senior salaried employees ' employment contracts .",120,18,0
positive,"This truly takes efficiency to new heights , '' Mr. Metso adds .",64,13,2
positive,"The Nokian tyre proves its high safety excellently in the important driving qualities stability with mark 1.4 , handling 1.5 and braking on wet road with 1.9 .",159,28,2
negative,Danish company FLSmidth has acknowledged that it has violated a patent held by Finnish Metso .,94,16,0
positive,"Finnish energy company Fortum Oyj said on November 13 , 2007 it was granted an environmental permit to build a biofuel-fired combined heat and power CHP plant in Vartan harbor in eastern Stockholm .",198,34,2
positive,"Profit for the period totaled EUR 39.4 mn , up from EUR 33.9 mn in the corresponding period in 2006 .",101,21,2
neutral,"JVC will stop producing DVD players in Brazil : JVC do Brazil , a subsidiary of Japan 's JVC group announced it will stop the production of DVD players in Brazil .",163,32,1
neutral,"CHS Expo Freight is a major Finnish fair , exhibition and culture logistics company that provides logistics services to various events by land , air and sea .",158,28,1
neutral,"In Finland , export industry forms a large clientele for the packaging industry .",81,14,1
positive,"The company 's scheduled traffic , measured in revenue passenger kilometres RPK , grew by just over 2 % and nearly 3 % more passengers were carried on scheduled flights than in February 2009 .",192,35,2
neutral,Vacon will supply drives to Ruselprom in the power range from 200 kW up to 2 MW .,81,18,1
neutral,"In the Baltics , the merger of the businesses of the two is expected to be completed in early 2008 .",100,21,1
neutral,Three students from Universiti Sains Malaysia have won a study trip to Helsinki .,81,14,1
neutral,"The Liquid Handling segment offers laboratory equipment and accessories , including mechanical and electronic pipettes , and disposable tips used in the research institutions , universities , and hospitals , as well as in the pharmaceutical , food , and other industries under the Biohit brand .",295,47,1
neutral,"The gross area of the Innova 2 project will be about 10,000 sq m ( 107,600 sq ft ) .",84,20,1
negative,Glaston 's net profit for the third quarter of 2007 dropped to 2.4 mln euro ( $ 3.5 mln ) from 3.5 mln euro ( $ 5.1 mln ) for the corresponding period of 2006 .,160,36,0
positive,The company is also featured in the Ethibel Pioneer Investment Register and included in Innovest 's Global 100 list of the world 's most sustainable corporations .,163,27,2
negative,Loss for the period totalled EUR 15.6 mn compared to a profit of EUR 6.3 mn in 2008 .,85,19,0
neutral,"Sponda is a property investment company , specialising in commercial properties in the largest cities in Finland and Russia .",125,20,1
negative,"It generated an operating loss of EUR 96.3 mn , down from a profit of EUR 43.9 mn .",83,19,0
positive,"Of the sales price , a sales gain of some 3.1 mln euro ( $ 4.5 mln ) will be recognized in Incap 's earnings for 2007 .",119,28,2
positive,"The metal has gained 41 percent this year as demand from China , the world 's largest user , increased .",104,21,2
negative,Also construction expenses have gone up in Russia .,51,9,0
neutral,"Global Markets Direct 's Pohjola Bank plc - Financial Analysis Review is an in-depth business , financial analysis of Pohjola Bank plc. .",137,23,1
negative,Salonen added that data shows producers ' pulp inventories in North America are declining . ',93,16,0
positive,"As part of the transaction , M-real and Sappi have also signed a long-term agreement on the supply of pulp and BCTMP and other smaller services and supplies .",158,29,2
negative,"Operating profits in the half were 0.8 m , down from 0.9 m as Glisten invested in the brand and the management team .",117,24,0
neutral,Margin call of Zanadvorov has given the chance to make such purchase under the credit of Deutsche Bank for USD 560 million .,124,23,1
positive,"By 14:29 CET on Monday , shares in Bavarian Nordic had climbed 1.21 % to DKK250 on the stock exchange in Copenhagen after having lost 7.41 % in the past month .",160,32,2
positive,"9 September 2010 - Finnish stationery and gift retailer Tiimari HEL : TII1V said today its net sales rose by 2 % year-on-year to EUR5 .7 m in August 2010 , driven by growth in Finland , while demand in the Baltics remained weak .",229,45,2
neutral,Radiation and today is a full service house expert in radiation and nuclear safety issues .,91,16,1
neutral,"As a condition to the deal , Savcor Alfa has to have bought Photonium and Akseli Lahtinen Inc. 's business operations prior to the deal .",137,26,1
neutral,"Since the registration of the shares subscribed in a directed share issue , the new number of Panostaja shares and voting rights is 41,733,110 .",144,25,1
neutral,"According to Finnair Technical Services , the measure is above all due to the employment situation .",100,17,1
positive,"Cargotec Corporation , Press Release , August 26 , 2008 at 10 a.m. Finnish time Cargotec 's MacGREGOR business area providing marine cargo handling and offshore load handling solutions has received significant offshore crane retrofit order .",241,37,2
negative,"( ADPnews ) - Feb 3 , 2010 - Finland-based steel maker Rautaruukki Oyj ( HEL : RTRKS ) , or Ruukki , said today it slipped to a larger-than-expected pretax loss of EUR 46 million ( USD 64.5 m ) in the fourth quarter of 2009 from a",230,49,0
positive,Sanoma Magazines Finland 's net sales grew to EUR 140.1 mn from EUR 131.8 mn .,78,16,2
negative,"The decision means temporary lay-offs of fixed duration at the company 's Nastola and Jyvaskyla units , in southern and central Finland , respectively .",152,25,0
neutral,The companies aim to close the deal before the end of the year .,64,14,1
neutral,"Okmetic closed its plant in Espoo in early 2004 , and all production lines from the site were moved to Okmetic 's plants in Vantaa , Finland and Texas , USA .",158,32,1
neutral,YIT Kausta will build commercial and residential highrises in Virsuliskes area .,80,12,1
positive,"OUTOTEC OYJ PRESS RELEASE , FEBRUARY 19 , 2008 AT 11.00 AM Outotec has won two large minerals processing technology orders from Mirabela Mineracao do Brasil Ltda , Brazil and from Cumerio Med JSCo , Bulgaria .",209,37,2
neutral,"Salcomp 's charger manufacturing plant in India is located in the Nokia Telecom Park in the state of Tamil Nadu , in the eastern part of India .",144,28,1
negative,"Finnish textiles and clothing group Marimekko Oyj posted a net profit of 7.99 mln euro $ 10.4 mln for 2006 , compared to 8.4 mln euro $ 10.9 mln for 2005 .",155,32,0
negative,"Divisional sales demand in the half remained `` inconsistent '' , it added .",76,14,0
neutral,The transaction was announced on September 29 when Pohjola Insurance agreed to pay EUR 80 million ( USD 106.3 m ) in cash for Pohjantahti .,139,26,1
neutral,Ramirent Finland is the domestic unit of machinery rental company Ramirent Oyj HEL : RMR1V .,92,16,1
negative,SRV lowered its net sales estimate for the whole of 2008 due to uncertainties in housing sales .,96,18,0
negative,Sales at the unit slumped last year after the industry was hit by poor snowfall in the major resorts in the winter of 2006-07 .,127,25,0
negative,"The payment of 2.779 million litas in interest on a long-term loan provided by Ragutis ' majority shareholder , Estonia 's A. Le Coq , also added to the losses .",161,31,0
negative,"Cencorp 's net sales in the first quarter is estimated to be EUR0.9-1 .2 m , as compared to EUR4 .5 m in the first quarter 2008 .",129,28,0
positive,Cargo volume grew by 7 % .,26,7,2
positive,"London 's leading shares today jumped almost 100 points , or 1.7 % , as the market opened .",91,19,2
neutral,Nokia and Capcom announced that Resident Evil Degeneration will be released on N-Gage later this year .,103,17,1
neutral,"In 2007 , the Group 's net sales stood at EUR 22 million and it had about 150 employees at the end of June , 2008 .",115,27,1
neutral,What would you like to see changed on Nokia 's next attempt ?,61,13,1
negative,The company said that its comparable operating profit for the January-June period fell short of last year 's corresponding performance .,136,21,0
negative,This is bad news for the barbeque season .,42,9,0
positive,"Overall , 50 percent of respondents were confident about their security when banking online .",93,15,2
neutral,"The transaction , which includes US$ 1.5 billion euro1 billion in cash , vendor notes and share purchases , is expected to be completed in the first quarter of 2008 , the Finnish-Swedish paper maker said .",205,37,1
negative,Okmetic expects its net sales for the first half of 2009 to be less than in 2008 .,82,18,0
neutral,The plans will result in the introduction of new and highly specialized manufacturing methods and also entail changes to personnel at the facility .,148,24,1
neutral,"The price of the 10,000 kroon par value bonds was 9663,51 kroons in the primary issue .",87,17,1
neutral,Comptel Corporation will publish its financial statements for 2008 on 12 February 2009 .,88,14,1
negative,Bosse added that Trygvesta does not have the financial strength to acquire the entire unit .,92,16,0
positive,Kone 's net sales rose by some 14 % year-on-year in the first nine months of 2008 .,83,18,2
positive,"Jarmo Honkamaa , head of the oil refining business at Neste Oil , says the situation looks promising from their viewpoint .",123,22,2
neutral,"The floor area of the Yliopistonrinne project will be 7,900 sq m 85,030 sq ft and the building 's gross area will total 12,800 sq m. A total 25.1 % of the facilities have been let .",181,37,1
neutral,The transaction will take place without payment of merger consideration .,73,11,1
positive,"The OMX Nordic 40 ( OMXN40 ) index , comprising the 40 most traded Nordic stocks on the Nasdaq OMX exchange , closed up 1.29 % at 1,084.47 points on Friday .",157,32,2
positive,The Group also has a strong global position in other fishing categories .,73,13,2
positive,"Operating profit was EUR 24.5 mn , up from EUR 23.0 mn .",56,13,2
neutral,"In connection with the deal , Digia will employ 19 persons from Nokia in Oslo and in Silicon Valley in the USA .",112,23,1
neutral,"Demonstrations of the broad capabilities of the Mobility Business Suite will be organized during the 3GSM World Congress in Barcelona , from February 12th to 15th .",164,27,1
positive,"Operating profit totalled EUR 21.1 mn , up from EUR 18.6 mn in 2007 , representing 9.7 % of net sales .",103,22,2
neutral,Why not subscribe to the magazine ?,35,7,1
positive,"The company said that paper demand increased in all of its main markets , including of publication papers , and that it increased average paper prices by 4 percent compared with last year .",189,34,2
negative,"The negotiation has resulted in the reduction of 80 people in regular employment , around half of which will be covered with pension arrangements .",147,25,0
neutral,"Votorantim Celulose e Papel ( VCP ) is part of the Votorantim Group , a major Brazilian conglomerate .",102,19,1
neutral,"The cooperation will involve Arena Partners buying a 35 % share of the new joint venture company , operating in Alma Media 's home sales , vehicle and consumer advertising marketplace businesses .",196,33,1
neutral,The unit is planned to be operational during the second half of 2007 and in full stream in 2008 .,97,20,1
positive,"Wartsila won the contract in October 2007 and the plant will be installed at Manturovo in the Kostroma region of Russia , about 600 km northeast of Moscow , Russia .",165,31,2
neutral,"Niina Nenonen , Marimekko 's current director for clothing , bags and accessories lines , will take up this role .",114,21,1
positive,"The most loyal customers were found in the Bank of +_land , with an index of 8.0 .",82,18,2
neutral,The value of the contracts is about EUR 3.3 mn .,48,11,1
neutral,"The company is headquartered in Sievi , Finland , and is listed on the Nordic Exchange in Helsinki .",100,19,1
neutral,"Koduextra is operating a retail chain of 11 stores , controlled by Finnish Non-Food Center KY , Rukax OY , and Scan-Tukka OY .",126,24,1
positive,Finland 's Poyry Energy has won a contract to advise builders of a new cogeneration power plant in Lithuania 's second-biggest city of Kaunas and to supervise the construction process .,185,31,2
neutral,Ahlstrom 's share is quoted on the NASDAQ OMX Helsinki .,56,11,1
neutral,The company distributes Hiab 's products as well as other products .,68,12,1
neutral,"KONE , headquartered in Espoo , Finland , is one of the world 's leading elevator and escalator companies .",107,20,1
negative,"`` The considerably weaker U.S. dollar and British pound had an impact on sales and average prices in euros , '' UPM said .",123,24,0
neutral,The adjustments concern staff in both the Specialty Papers and the Fiber Composites segments .,94,15,1
negative,"At the close , the OMX Helsinki 25 was 0.01 pct lower at 3,067.64 points and the OMX Helsinki was down 0.05 pct at 10,321.46 points on over 1.343 bln eur of turnover .",167,34,0
neutral,The retail chain launched in 2007 does not correspond to profit and sales forecasts of the company .,100,18,1
neutral,"According shipping company Viking Line , the EU decision will have a significant financial impact .",99,16,1
positive,"Finland 's Nokian Tyres and Kazakhstan 's Ordabasy Corporation signed an agreement to build a plant in Astana to produce car tires , Ordabasy chairman Dinmukhamet Idrisov said at a press conference .",199,33,2
positive,"Profit before taxes was EUR 5.4 mn , up from EUR 3.6 mn a year earlier .",72,17,2
neutral,"According to statistics by the Finnish Maritime Administration , shipping did not increase much in January-August 2009 , however .",130,20,1
negative,They are also upset that some of the machinery and work is taken over to Poland .,81,17,0
neutral,"ALEXANDRIA , Va. , Oct. 3 -- Markka A. Oksanen and Harald Kaaja , both of Helsinki , Finland , Juha Salokannel of Kangasala , Finland , and Arto Palin of Viiala , Finland , have developed a system for providing communications security .",236,44,1
neutral,Finnish fibre-based materials maker Ahlstrom Corp ( HEL : AHL1V ) said today it decided to close down its spunlace composite production line number 23 at Chirnside plant in the UK by the end of March 2011 .,206,38,1
neutral,"In April-June 2008 , Scanfil 's net sales totalled EUR 58.7 mn and operating profit EUR 6.6 mn .",96,19,1
positive,"Operating profit for the three-month period increased from EUR1 .2 m , while revenue increased from EUR20 .2 m , as compared to the corresponding period in 2005 .",162,29,2
positive,"Vaisala Oyj Press Release September 30 , 2010 Vaisala has signed a contract to sell its oxygen measurement technology and business to SICK Maihak GmbH .",152,26,2
neutral,"According to Finnish FIM Bank , Alpro 's price would be around EUR 100mn-150mn .",80,15,1
negative,"have notified that as a result of the Company issuing 14,432,000 new shares in the directed offering , the joint holdings of Pequot has decreased below 1-10 to 9.63 % of total number of shares and votes in the Company .",219,41,0
neutral,"With this , the company will exit the contract manufacturing service segment .",78,13,1
neutral,The contract is worth some EUR 1 million .,42,9,1
neutral,Estimations indicate that even up to 170 different tablet computers or reading devices will be available in 2011 .,114,19,1
neutral,"In June it sold a 30 percent stake to Nordstjernan , and the investment group has now taken up the option to acquire EQT 's remaining shares .",142,28,1
neutral,The ship unloader is totally enclosed along the entire conveying line to the storage facilities .,97,16,1
positive,"Ixonos estimates that it will hire 20 specialists in mechanical engineering , electronics design , and R&D for its new unit in Jyvaeskylae by the end of 2009 .",159,29,2
neutral,"The total floor area of the plant expansion is 29,000 square metres .",69,13,1
neutral,All depends on financing .,26,5,1
neutral,ASSA ABLOY Kaupthing Bank gave a ` neutral ' recommendation and a share price target of 174 crowns $ 24.7 - 19 euro on Swedish lock maker Assa Abloy AB .,153,31,1
neutral,"New Delhi , July 17 -- Sahlberg Teppo , Kallio Timo and Mustonen Tuomas of M Real OYJ , Espoo , Finland have developed novel markings and methods of producing the same .",169,33,1
neutral,EUR 220 million of the transaction consideration was paid in the form of four-year interest-bearing vendor notes .,114,18,1
positive,"Net sales will , however , increase from 2005 .",47,10,2
positive,Net sales increased to EUR655m in April to June 2010 from EUR438m a year earlier .,82,16,2
neutral,It will provide heating in the form of hot water for the sawmill 's needs .,75,16,1
neutral,"The Segu companies and PKC 's Polish unit will form a business servicing the western European markets with `` annual sales of about hundred million '' and about 2,500 employees , the Finnish company 's CEO , Harri Suutari , said .",230,42,1
neutral,"Previously , Vaahto Pulp has supplied headboxes with rectifier roll and dilution control technology for Stora Enso 's mill in Imatra , eastern Finland .",152,25,1
positive,Major Order in India Comptel Corporation has received a significant long-term order for mediation and provisioning solutions being used by a leading operator in India .,168,26,2
neutral,"We bring a new , committed leadership and business and strategic know-how to the company that we buy .",102,19,1
neutral,The total value of these two contracts is over EUR 21 million .,63,13,1
neutral,The Remote Radio head module will be available at 4W power for 2.5 GHz and 3.5 GHz TDD frequency bands .,104,21,1
positive,"Kemira Coatings is the leading supplier of paints in Northern and Eastern Europe , providing consumers and professionals with branded products in approx .",154,24,2
neutral,"Swiss bank Credit Suisse International will act as an investor in the locomotive manufacturing plant , the Astana administration said .",135,21,1
positive,Operating profit improved by 27 % to EUR 579.8 mn from EUR 457.2 mn in 2006 .,77,17,2
neutral,Elisa will expand the use of this technology provided the pilot proves successful .,83,14,1
neutral,According to the announcement of the Helsinki Stock Exchange the share of Sentera shall be delisted from the NM-list of the Helsinki Stock Exchange accordingly .,161,26,1
neutral,"Elcoteq SE Stock Exchange Announcement February 4 , 2009 at 10.00 am ( EET ) Elcoteq will publish its financial statements bulletin 2008 on Wednesday , February 11 , at 9.00 am ( EET ) .",186,36,1
positive,Raute said it has won an order worth around 15 mln eur to supply several plywood production lines to mills operated by Russian wood products company Sveza Group .,162,29,2
neutral,Aktia forecasts Finland 's inflation at 1.1 % in 2010 .,55,11,1
neutral,4 ) Complete name of the shareholder : Otto Henrik Bernhard Nyberg 5 ) Further information : The amount of shares now transferred corresponds to 5.68 % of the total number of shares in Aspo Plc. .,196,37,1
neutral,"After the split , the number of K shares will be 9 540 000 and the number of A shares 26 885 540 .",98,24,1
positive,"According to Finnish insurance companies Tapiola , Local Insurance Group ( L+Æhivakuutus ) , and Pohjola the two fierce storms at the end of July and in the beginning of August 2010 that felled trees around Finland have speeded up sales of forest insurance .",258,45,2
positive,"Finnish Cargotec 's Kalmar , the business area providing container handling solutions , has been awarded an order for a further ten E-One rubber-tyred gantry RTG cranes from Saigon Newport Company SNP , in Vietnam .",215,36,2
neutral,` Nordic infrastructure construction is one of our strategic growth areas .,75,12,1
neutral,"The government started the sell-off last month , putting an 8 percent stake in TeliaSonera on the auction bloc .",112,20,1
neutral,"`` EB Tough VoIP was designed to fulfill the communications needs of military units , and we continue to strive towards achieving that goal , '' Mikko Viitaniemi , EB Elektrobit Defense Products , Wireless Solutions senior manager , said in a statement .",254,44,1
positive,"Finland 's leading metals group Outokumpu said its fourth-quarter net profit more than tripled on the back of strong global demand for stainless steel , soaring base metal prices and proceeds from the sale of its technology unit .",230,39,2
neutral,"During the past 10 years the factory has produced many of Nokia 's most popular models including the Nokia 2760 , the Nokia 6300 as well as Nokia 's latest music device the Nokia 5800 Express Music .",199,38,1
neutral,Subject-matter of the invention furthermore is the use of the cyclone for separating partly molten particles . '',113,18,1
negative,Finland-based Stockmann Group has closed seven franchising sports stores Nike in Russia .,89,13,0
neutral,"The reasons behind the estimate include the rise in 2008 rent levels and several fully-leased office and retail properties , which were completed and added to the company 's investment property portfolio .",205,33,1
positive,The parties have also agreed on options that allow UH to extensively implement later on also functionalities of human resources management .,140,22,2
neutral,The group 's net sales in 2007 were EUR683 .6 m.,48,11,1
negative,"According to Finnish petrol station chain St1 's managing director Kim Wiio , the company was forced to make purchases with rising prices in the first half of 2008 , and now consumer prices are going down almost daily due to competition .",238,43,0
neutral,Export accounts for about one tenth of the company 's annual turnover of one billion kroons .,93,17,1
negative,"When this information was released on 5 September 2008 , Nokia 's American Depositary shares fell by 8 % .",106,20,0
positive,"For the current year , Raute expects its net sales to increase and the operating result -- to be positive .",107,21,2
neutral,It 's very difficult to become a Google Analytics channel partner .,67,12,1
positive,Merrill Lynch analyst Campbell Morgan upgraded his recommendation on PaperlinX from `` neutral '' to `` buy '' in May .,119,21,2
neutral,"Nurminen Logistics provides high-quality logistics services , such as railway transports , terminal services , forwarding , special and heavy transports and medical transports .",177,25,1
neutral,"The Group 's consolidated net sales for 2009 totaled 1.5 billion euros and it employs approximately 10,000 persons .",116,19,1
neutral,"Following the issue , the number of shares in the Swedish company will grow by 9 % .",84,18,1
neutral,"According to CapMan Plc 's Corporate Governance , the majority of the committees ' members shall be independent of the Company .",128,22,1
neutral,"At 3:37 p.m. Eastern time , a block of 2,400 contracts changed hands at a bid price of $ 0.45 .",95,21,1
neutral,Tiimari operates 194 stores in six countries -- including its core Finnish market -- and generated a turnover of 76.5 mln eur in 2005 .,135,25,1
