sentiment,text,char_count,word_count,label
neutral,"Poyry is a global consulting and engineering firm focusing on the energy , forest industry and infrastructure & environment sectors .",133,21,1
positive,CEO of the company Tarmo Noop said the growth in the sale of premium beers was the biggest .,92,19,2
positive,"In banking , Sampo A was unchanged at 14.24 eur and Nordea rose 0.42 pct to 9.51 eur .",86,19,2
neutral,"A total of 15,000 new Citycon shares with a nominal value of EUR 1.35 per share were subscribed between 17 and 23 March 2006 exercising the A-B-C options based on the company 's stock option plan 1999 .",202,38,1
positive,20 October 2010 - Finnish metal products company Componenta Oyj HEL : CTH1V said yesterday that its net loss narrowed to EUR7m for the first nine months of 2010 from EUR23 .3 m for the same period of 2009 .,206,40,2
positive,The diluted loss per share narrowed to EUR 0.27 from EUR 0.86 .,63,13,2
neutral,"Paychex has more than 100 offices serving approximately 554,000 payroll clients nationwide as of May 31 , 2009 .",112,19,1
neutral,The European Central Bank ECB is anticipated to raise its benchmark interest rate in the second half of 2011 at the earliest .,126,23,1
neutral,Finnish Benefon denies claims made in the press that the company is giving up its mobile handset business .,107,19,1
neutral,As a consequence the Works Council had withdrawn its petition to suspend the reorganisation .,93,15,1
neutral,Currently the quarterly applied surcharges differ significantly from the actual market prices .,95,13,1
negative,"Finnish Food Workers ' Union SEL plans to hasten its collective bargaining with a two-day strike that would begin on 7 April 2010 , in Finland .",144,27,0
neutral,Deliveries by Outotec will take place over 30 months .,54,10,1
neutral,Mr Skogster currently serves as the manager responsible for ABB Oy 's system modules for low voltage drives .,109,19,1
positive,"The total area of the Gorelovo plant is about 22,000 sq m. Atria invested about EURO 70mn in the plant , which should double Atria Russia 's production capacity in the St Petersburg area .",188,35,2
positive,"The EBITDA was EUR116m compared to EUR115m , corresponding to an EBITDA margin of 33 % .",88,17,2
positive,"Finnish engineering and technology company Metso Oyj said on May 27 , 2008 it completed the acquisition of paper machinery technology from Japanese engineering company Mitsubishi Heavy Industries ( MHI ) for an undisclosed sum .",228,36,2
neutral,"In addition to the presentations held by President & CEO Kai Telanne and CFO Tuomas Itkonen , participants will have an opportunity to discuss with other members of the company 's management .",192,33,1
neutral,The fixed acquisition price amounts to NOK 70 ( approximately EUR 8.7 ) million and additional price NOK 15 ( EUR 1.8 ) million at maximum .,140,27,1
negative,"Finnish plumbing and heating systems supplier Uponor 's net sales in continuing business operations decreased to EUR 249.1 mn in July-September 2008 , compared to EUR 262.1 mn in the third quarter of 2007 .",206,35,0
neutral,Pharmaceuticals - Czech Republic This brand-new market analysis gives a clear overview of the actual situation and future outlook of the pharmaceutical market in Czech Republic .,178,27,1
neutral,Delhaize Le Lion has selected the Aldata G.O.L.D. Vocal PDA solution on the Motorola WT4090 PDA terminal .,106,18,1
positive,"Kai Tulonen , Chief Technology Officer , SysOpen Digia says : `` We have been using Corporate Phonebook inside SysOpen Digia extensively since last fall , and we have been very satisfied with the results .",205,36,2
positive,in Q1 2010 18 May 2010 - Finnish electrical components maker Salcomp Oy ( HEL : SAL1V ) said today it turned to a net profit of EUR1 .6 m in the first quarter of 2010 versus a loss of EUR2m in the corresponding period last year .,229,48,2
neutral,"The sellers include 40 shareholders , including Intellibis management , employees and other investors .",103,15,1
negative,Commission income fell to EUR 4.6 mn from EUR 5.1 mn in the corresponding period in 2007 .,90,18,0
neutral,"UK 's Sarantel to outsource part of its processes to Elcoteq plant in Estonia LONDON , Oct 13 , BNS - The British miniature antennas maker Sarantel has signed an agreement to outsource its assembly test and supply chain processes to the plant of Elcoteq in the Estonian capital Tallinn .",287,51,1
positive,"With the extension of the new contract for a further eight engines , the plant will now produce over 100 MW , it said .",119,25,2
neutral,"The corresponding increase in the share capital , in total EUR 300,00 was registered in the Finnish Trade Register on May 8 , 2008 .",132,25,1
neutral,Country : ; Germany Sector : Construction-Real Estate ; Machinery-Engineering Target : Caverion GmbH Buyer : YIT Oyj Deal size in USD : 90.3 m Type : Corporate acquisition Status : Agreed,187,32,1
negative,Earnings per share ( EPS ) dropped to EUR 0.21 from EUR 0.31 .,62,14,0
neutral,"Outotec , headquartered in Espoo , Finland , is a leading provider of process solutions , technologies and services for the mining and metallurgical industries .",161,26,1
neutral,Panostaja Oyj 's Board also decided at its organisational meeting held upon completion of the AGM to implement the AGM decision concerning Board member fees paid as shares in such a way that shares are transferred on a quarterly basis on the date following publication of the quarterly-annual report .,301,50,1
positive,These companies will be able to keep their market positions .,61,11,2
neutral,Deliveries will start in the second half of 2007 and the start-up of the mill is scheduled for 2008 .,101,20,1
neutral,"Cramo Plc is a service company specialising in construction machinery and equipment rental and rental-related services , as well as rental and sale of modular space .",166,27,1
neutral,"The Finnish food concern Atria is about to acquire two Estonian meat processing companies , Woro Kommerts and Vastse-Kuuste Lihatoostus , reported the Official website www.investinestonia.com .",193,27,1
neutral,"Berling Capital , Umo Capital and Veikko Laine are the biggest shareholders in Amanda Capital .",95,16,1
neutral,Nokian Tyres ' tyres are considered genuine winter tyres in Russia .,68,12,1
neutral,"Name of Applicant : Jot Automation OYName of Inventor : Mammila Tuomo , Piirainen Mika and Kellokoski MikaApplication No. : 2424-KOLNP-2008 ADate of filing of Application : 16-06-2008Publication Date : 30/01/2009",212,31,1
neutral,The subsidiary is setting up a facility for manufacturing high-density interconnection printed circuit boards or PCBs at Nokia 's special economic zone at Sriperumbudur near Chennai .,183,27,1
neutral,"Due to Pirkka beer , Olvi 's brewery in Iisalmi is moving to 7-day , 24-hour work shifts .",90,19,1
positive,"The company , which makes garden tools , scissors and other consumer goods , said earnings were boosted by 6.9 mln eur of income it received from its 16.7 pct shareholding in Finnish engineering group Wartsila .",211,37,2
positive,The program 's target is structural cost reductions of about EUR 30mn in 2009 .,79,15,2
neutral,"The company will disclose further details , including the anticipated transaction timetable and the name of the new investor , within one week .",144,24,1
positive,Global Banking News - 28 September 2010 Tieto Corporation and Pohjola Bank ( PINK : POJLF ) are to cooperate on SWIFT services .,128,24,2
positive,Business boomed after Ostrom helped plant a small story about Rapala lures in a Life magazine issue that featured Marilyn Monroe on the cover .,143,25,2
neutral,"In the method the smelt spouts 2 are separated from the working area 6 by a shielding wall 8 , 10 arranged movable in relation to the smelt spouts .",148,30,1
neutral,Basware Business Transactions Service enables the customer to receive and send invoices in an electronic format .,113,17,1
negative,"Making matters more difficult , the company said it has been grappling with higher oil and gas prices , which have pushed up the cost of energy , raw materials and transportation .",180,33,0
neutral,The smaller molecules improve the grip of the tyre at top-speed driving .,73,13,1
neutral,"Panostaja Plc today acquired the entire share capital of Suomen Graafiset Palvelut Ltd , a provider of printing services .",122,20,1
positive,Diluted earnings per share ( EPS ) rose to EUR 3.68 from EUR 0.50 .,67,15,2
positive,`` Residentialconstruction in particular has picked up in several markets .,75,11,2
positive,"Profit after taxes was EUR 0.1 mn , compared to EUR -0.4 mn the previous year .",79,17,2
negative,"Operating result , excluding one-off items , totaled EUR 9.1 mn compared to EUR 10.6 mn in continuing operations , excluding one-off items in 2004 .",148,26,0
positive,"Nokia , which has a strong track record in the lower-end handset market , said in July its touch-screen offering would come this year and be cheaper than rival models in order to tap into a higher-volume market .",212,39,2
neutral,BM4 middle layer headbox will be equipped with a dilution control system .,74,13,1
neutral,Incap Contract Manufacturing is a subsidiary of Incap Corporation of Finland .,78,12,1
neutral,Performance is based on values and sustainability .,51,8,1
neutral,"It expects revenue between $ 8.4 billion and $ 8.7 billion , compared to analyst estimates of $ 8.67 billion .",110,21,1
neutral,The companies signed the letter of intent for the sale on 17 September 2010 and envisaged to seal the actual agreement on 1 January 2011 .,138,26,1
negative,Finnish business software group AffectoGenimap Oyj said its net profit halved to 1.2 mln euro ( $ 1.5 mln ) in the first nine months of 2006 from 2.2 mln euro ( $ 2.8 mln ) in the same period of 2005 .,201,43,0
neutral,"Retail chain Suomen L+Æhikauppa was given the index 5.8 , airline SAS 5.8 , TeliaSonera 's broadband 6.1 , German retail chain Lidl 6.1 , Tele Finland 's mobile subscriptions 6.1 , Tallink shipping line 6.3 , and power company Helsinki Energy 6.3 .",248,44,1
neutral,UNC Charlotte would also deploy SSH Tectia Connector to enable secure application connectivity .,96,14,1
neutral,`` Management decided at the end of 2005 to increase cathode copper capacity .,78,14,1
negative,Market share decreased on the route between Helsinki in Finland and Tallinn in Estonia by 0.1 percentage points to 24.8 % .,123,22,0
neutral,"The power supplies , DC power systems and inverters designed and manufactured by Efore , and systems incorporating them are used in many different applications .",161,26,1
positive,"The iTunes-based material will be accessible on Windows-based or Macintosh computers and transferable to portable devices , including Apple 's iPods .",150,22,2
positive,"Tieto offers Aktia a good foundation and the required support services for implementing the update project , ' says Juha Volotinen , responsible for Aktia 's web services .",172,29,2
neutral,`` Lemminkainen Talo Oy 's Lahti office is a significant logistics and business premises constructor .,102,16,1
neutral,"The company also appointed Leif Rosen head of the Special Plate unit which includes the quarto plate units in Degerfors , Sweden , and New Castle , USA , the unit in Willich , Germany , as well as Pressplate and Prefab in Avesta and Plate Service Centre Nordic in Degerfors .",275,52,1
negative,"Operating margin , however , slipped to 14.4 % from 15.1 % , dragged down by a poor performance in enterprise solutions .",121,23,0
positive,"The contract covers HDO platform , AC800 and CXE880 optical Fttb nodes designed to increase the forward and return path capacity of the transmission networks .",159,26,2
neutral,Talvivaara Mining Company Plc Talvivaara Mining Company is an internationally significant base metals producer with its primary focus on nickel and zinc using a technology known as bioheapleaching to extract metals out of ore .,227,35,1
neutral,I thank Jarmo Ukonaho warmly for his contribution and wish him all the best in the future challenges . '',105,20,1
neutral,"The ship cranes , which will be manufactured by MacGREGOR 's partner plants in China , will be delivered between 2008-2010 for vessels ordered by Chinese COSCO , German Peter Dohle and Hong Kong based Cido Shipping .",216,38,1
neutral,The solvency capital ratio of both companies was 2.7 times the solvency limit .,79,14,1
neutral,SSH Establishes New Global Sales and Marketing Group to be led by George Adams ; Adams Establishes Global Sales and Marketing Group to Drive Worldwide Programs Supporting SSH Tectia Enterprise Security Solutions,211,32,1
positive,"Finnish silicon wafers manufacturer Okmetic Oyj said on June 29 , 2007 it signed an agreement with Nordea Bank Finland Plc , the local subsidiary of Swedish commercial bank Nordea Bank AB , which will refinance Okmetic 's syndicated bank facility which amounts to some 20 mln euro ( $ 26.9 mln ) .",297,54,2
positive,"According to Finnish Aktia Bank 's Managing Director Jussi Laitinen , the bank 's aim is to triple the number of its customers in Finland in the next five years .",162,31,2
positive,"Net interest income was EUR 39.3 mn , up from EUR 32.7 mn .",59,14,2
neutral,"Unbelievably , the company that makes them - Fiskars Corporation - was formed in 1649 when a Dutch merchant named Peter Thorwoste was given a charter to establish a blast furnace and forging operation in the small Finnish village of Fiskars .",242,42,1
positive,"According to Sepp+Ænen , the new technology UMTS900 solution network building costs are by one-third lower than that of the building of 3.5 G networks , operating at 2,100 MHz frequency .",187,32,2
neutral,"Information system supplier Sentera -- up 24.51 pct -- was the next most heavily traded share after SysOpen Digia , a software house , acquired 77.4 pct of the company this morning for just under 33 mln eur .",208,39,1
negative,"So far Norwegian Norske Skog has reduced the staff levels by 1,000 people and plans to reduce production by 200,000 tons in 2008 , while Finnish-Swedish Stora Enso is to cut staff by 1,700 people and production by 500,000 tons .",228,41,0
neutral,Dragonfly Love is another video shot from start to finish using the Nokia N8 .,78,15,1
positive,Finnish fibers and plastic products maker Suominen Corporation said its net loss from continuing operations narrowed to 1.8 mln euro ( $ 2.3 mln ) in 2006 from 3.7 mln euro ( $ 4.8 mln ) in 2005 .,196,39,2
positive,Operating profit excluding restructuring costs grew to EUR 44.5 million from EUR 31.7 million while operating profit including restructuring costs showed even larger growth to EUR 38.5 million from EUR 7.4 million .,215,33,2
positive,Net sales of Finnish food industry company L+Ænnen Tehtaat 's continuing operations increased by 13 % in 2008 to EUR 349.1 mn from EUR 309.6 mn in 2007 .,153,29,2
neutral,"To achieve synergy targets related to the acquisition , Vaisala is consolidating its manufacturing , depot and data services , and finance activities currently located in Uniontown , Pennsylvania , St. Louis , Missouri and Durham , North Carolina .",248,40,1
negative,- The Group - s result before taxes was EUR -1.9 ( -3.0 ) million .,68,16,0
positive,"The company said that it will supply the WCDMA 3G-HSPA radio network , including the modular , high capacity Nokia Flexi WCDMA base station in East Java , Bali , Sumatra and Batam .",181,34,2
neutral,"Look out for vintage fabric cushion covers , '70s coffee pots , ceramic serving dishes , cocktail glasses , and stainless steel party dishes .",142,25,1
positive,"Finnish telecoms software developer Tecnomen Oyj said on December 5 , 2006 it won a $ 3.3 mln ( 2.5 mln euro ) order to supply an expansion of the charging and messaging systems for the mobile and fixed networks of Brasil Telecom .",231,44,2
positive,Componenta increased its stake in Turkish steel company Doktas Dokumculuk Ticaret ve Sanayi A.S. to 92.6 pct stake in March 2007 .,130,22,2
neutral,"It is positive that the company it recruited Harri Koponen as CEO , according to Affarsvarlden .",96,17,1
positive,"Upgrades include a five megapixel camera , voice control , and what looks to be an optical mouse instead a D-pad -- an upgrade click-happy S60 has needed forever .",163,30,2
negative,Last year 's third quarter result had been burdened by costs stemming from restructuring in the US .,100,18,0
neutral,"The device can also be used for theft protection and positioning of vehicles , boats and other assets .",103,19,1
neutral,The first of the two project phases is expected to be completed by the end of 2012 .,84,18,1
positive,"The two companies will also partner in further developing Raiso 's cholesterol lowering brand , Benecol .",105,17,2
neutral,"Founded in 1946 , Strand Associates , which provides civil , environmental , transportation , electrical and mechanical engineering services , has 350 employees at 10 offices in Wisconsin , Alabama , Illinois , Indiana , Kentucky and Ohio .",240,40,1
negative,"Finnish Scanfil , a contract manufacturer and systems supplier for communication and industrial electronics reports net sales of EUR 108.7 mn in the first half of 2008 , down from EUR 111.1 mn a year earlier .",209,37,0
positive,"Nyrstar has also agreed to supply to Talvivaara up to 150,000 tonnes of sulphuric acid per annum for use in Talvivaara 's leaching process during the period of supply of the zinc in concentrate .",195,35,2
positive,CDLI highlights the companies that provided the most comprehensive response to the Carbon Disclosure Project CDP information request .,134,19,2
negative,"Capacity will ease at its Seikku sawmill in Pori and Alholma sawmill in Pietarsaari and result in 60 people being laid off for around six weeks starting mid-May , it said .",172,32,0
neutral,"On Dec. 1 , Grimaldi acquired 1.5 million shares and a 50.1-percent stake in Finnlines .",88,16,1
neutral,Also Chile is an important market area for forest machine companies .,69,12,1
neutral,The parties have therefore agreed to leave Avena out of the deal .,66,13,1
neutral,The financial statements release will be available after publishing on the Company 's internet pages at www.cargotec.com .,122,18,1
positive,"Meanwhile , Nokia said that it will be able to deliver a complete range of services from deployment operations to consulting and integration to managed services as a result of the buyout .",188,33,2
positive,"EUR928 ,000 in Q1 2010 6 May 2010 - Finnish textile and clothing design company Marimekko Oyj ( HEL : MMO1V ) said today its net profit rose to EUR928 ,000 in the first quarter of 2010 from EUR13 ,000 in the corresponding period a year earlier .",245,48,2
neutral,The contract covers new energy-efficient AC drives that have been designed in cooperation between the companies .,113,17,1
positive,NORDIC BUSINESS REPORT-26 June 2006-Metso Corporation wins EUR50m equipment order in Australia -_ 1998-2006 M2 COMMUNICATIONS LTD The Finnish engineering and technology group Metso Corporation said on Monday ( 26 June ) that it has received a EUR50m equipment order in Australia .,280,43,2
negative,Finnish retail software developer Aldata Solution Oyj reported a net loss of 11.7 mln euro $ 17.2 mln for 2007 versus a net profit of 2.5 mln euro $ 3.7 mln for 2006 .,167,34,0
neutral,"POYRY PLCCompany Announcement 10 December 2010 at 4.10 p.m. Pursuant to Poyry PLC 's stock option program 2004 , 63 792 new shares of the company have been subscribed since 27 October 2010 with stock options 2004B .",215,38,1
neutral,Changes to the as-built models from the design were communicated to the subcontractors to accommodate them into the steel and GRC fabrication process .,151,24,1
neutral,"The company designs , manufactures and markets high-quality clothing , interior decoration textiles , bags and other accessories .",130,19,1
positive,1 Block lamp Harri Koskinen 's light was introduced in 1996 and has been a bestseller ever since .,98,19,2
positive,"Furthermore , Bunge will also sign a licensing agreement for the Sunnuntai and Carlshamn Mejeri brands .",104,17,2
neutral,"Metsa-Botnia will finance the payment of dividends , the repayment of capital and the repurchase of its own shares with the funds deriving from its divestment of the Uruguay operations , and shares in Pohjolan Voima , and by utilising its existing financing facilities .",270,45,1
neutral,"The total value of the project is estimated to be over 3.0 mln euro $ 4.4 mln , of which the services will be over 2.0 mln euro $ 2.9 mln and third-party licences more than 1.0 mln euro $ 1.5 mln .",197,43,1
neutral,In 2007 Etteplan reported a turnover of EUR125 .2 m.,52,10,1
positive,"Commission income increased by 22 % to EUR 4.4 mn , and lending volume rose by 13.5 % .",87,19,2
positive,This resulted in improved sales figures in Sweden .,51,9,2
negative,"Net sales for the financial year 2006 are expected to amount to about EUR20m and the operating result EBIT is expected to be a loss , as announced before .",155,30,0
positive,"When the situation normalises , the company will be able to increase the amount of residential units for sale in St Petersburg and Moscow , in particular .",155,28,2
positive,Aspocomp has repaid its interest bearing liability to Standard Chartered Bank and will use the rest of the consideration to partially repay its interest bearing liabilities in Finland and to improve its liquidity .,214,34,2
neutral,It has been agreed with the company 's Board of Directors that she will be available in an advisory role .,106,21,1
positive,"The total delivery volume of paper businesses in 2010 was 1,155,000 tonnes , up from 1,132,000 tonnes in 2009 .",111,20,2
positive,"` Ruukki has experience of logistics construction , competence in project management and also has the best references in terms of steel frame production and installation , ' says Onodi Stefan , General Manager of Arxikon Construction Company SRL , which is Ruukki 's customer .",277,46,2
neutral,"BAVARIA Industriekapital AG 's 2006 revenues were EUR 333 million , with an EBITDA of EUR 51 million .",102,19,1
positive,"The new office , located in Shenzhen , will strengthen Vaisala 's already 10-year old presence in China .",105,19,2
neutral,"The total investment in the Vantaa plant extension will amount to around 10 million euro , and Okmetic 's share of the investments will be worth around 2.7 million .",165,30,1
positive,Construction volumes meanwhile grow at a rate of 10-15 percent annually .,73,12,2
neutral,"Tikkurila Powder Coatings has some 50 employees at its four paint plants , which generated revenues of EUR2 .4 m USD3 .3 m in 2010 .",132,26,1
negative,"Qualcomm estimated a first-quarter profit between 46 and 50 cents a share , excluding certain items , below the analyst estimate of 61 cents a share .",150,27,0
neutral,The company says the measures are no longer needed .,52,10,1
neutral,"He found him again , however , after the driver was involved in a two-car accident .",84,17,1
negative,Swedbank 's shares have been hardest hit of the Swedish banks by the ongoing international financial crisis .,109,18,0
neutral,"Vaisala 's Present Weather Detector measures visibility up to 20 km , as well as precipitation type and intensity .",115,20,1
neutral,The acquisition price was not disclosed .,41,7,1
negative,"`` Adjustment to the fall in price level , in contrast , has been less effective .",82,17,0
positive,Marimekko Group 's full-year net sales are estimated to increase by about 10 % .,80,15,2
neutral,"( ADP News ) - Dec 11 , 2008 - Finnish power-supply solutions provider Efore Oyj ( OMX : EFO1V ) said yesterday it opened a technology research and development ( R&D ) laboratory at Helsinki University of Technology .",217,40,1
neutral,"The commission found evidence of several meetings to discuss the cartel , including one in a Brussels restaurant in November 1997 at which the companies discussed price increases .",180,29,1
neutral,The Court 's decision will also promote genuine competition in services,71,11,1
negative,"A total of 16.5 mn passenger ship journeys took place in the northern Baltic Sea in 2007 , slightly down from 16.5 mn in 2006 .",127,26,0
positive,"Previously , EB delivered a custom solution for LG Electronics and now is making it commercially available for other mobile terminal vendors as well as to wireless operators .",175,29,2
negative,"Last year , UPM cut production , closed mills in Finland and slashed 700 jobs .",79,16,0
negative,GSK announced in November 2008 that it would close its operations in Dartford .,79,14,0
neutral,Cargotec will also move Hallberg-Ivarsson 's service and installation business under the same roof with its service center for Kalmar and MacGregor solutions in Gothenburg .,173,26,1
neutral,Another firm Air Liquide was exempted because it left the market in 1998 .,74,14,1
neutral,The value of the order is EUR 2.5 mn .,38,10,1
negative,Diluted earnings per share ( EPS ) declined to EUR 0.78 from EUR 1.76 .,71,15,0
neutral,"Finnish diversified holding company Aspo Oyj said on September 8 , 2008 that it will sell the Finnish tape business of its Kaukomarkkinat unit to local Oy Telpak Ab .",166,30,1
neutral,The building will house product development and test laboratories .,67,10,1
positive,This will bring cost savings of about EUR 3mn a year .,54,12,2
neutral,"In this way , the industry 's starting point has been the consumers ' needs .",77,16,1
positive,Poyry has a good track record of major transportation projects in Latin America .,81,14,2
neutral,"It holds 38 percent of Outokumpu 's shares and voting rights , but in 2001 lawmakers gave it permission to reduce the stake to 10 percent .",139,27,1
positive,"The competition was received with great enthusiasm by the employees , he goes on .",82,15,2
