sentiment,text,char_count,word_count,label
positive,"a January 11 , 2010 EPHC board of directors has approved an increase in the quarterly dividend from $ 0.03 to $ 0.05 per share .",128,26,2
neutral,"Latin America currently accounts for approximately 40 % of sales at Tecnotree , company president and CEO Eero Mertano recently told BNamericas .",145,23,1
neutral,An EU law on the issue may be introduced around 2010 .,54,12,1
neutral,The final outcome of the rights offering is to be reported around 23 October 2009 .,83,16,1
positive,"Operating profit totalled EUR 5.8 mn , up from a loss of EUR 1.7 mn in the fourth quarter of 2009 .",99,22,2
negative,"26 October 2010 - Finnish environmental management company Lassila & Tikanoja Oyj ( HEL : LAT1V ) , or L&T , said today its net profit declined to EUR20 .9 m for the first nine months of 2010 from EUR27 .6 m for the same period a year earlier .",244,50,0
positive,Operating profit rose from EUR 1.94 mn to EUR 2.45 mn .,55,12,2
positive,"In contrast , the company 's net loss for the third quarter of 2009 contracted to EUR 76 million from EUR 256 million for the corresponding period a year ago .",159,31,2
negative,"In Finland , the city of Forssa has said it will not pay compensation to food industry companies HK Ruokatalo and Atria for the lye leak into tap water that occurred in March 2008 .",181,35,0
negative,"In Finland 's Hobby Hall 's sales decreased by 10 % , and international sales fell by 19 % .",92,20,0
neutral,Why not give your bedroom a cool makeover for summer .,54,11,1
neutral,"( ADPnews ) - Dec 30 , 2009 - Finnish investment group Neomarkka Oyj ( HEL : NEMBV ) said today that it will furlough employee in its unit Reka Cables Ltd for less than 90 days , starting in January 2010 .",205,43,1
neutral,"Rinkuskiai 's beer sales fell by 6.5 per cent to 4.16 million litres , while Kauno Alus ' beer sales jumped by 6.9 per cent to 2.48 million litres .",148,30,1
neutral,"Incap Contract Manufacturing Services Pvt Ltd , a subsidiary of Incap Corporation of Finland , is acquiring the manufacturing unit of the TVS Electronic Ltd at Tumkur , near Bangalore , for Rs40 crore .",202,35,1
neutral,Sanoma will continue to focus on investing in digital media and on strengthening its market positions .,103,17,1
positive,The members of the management team will contribute to the adjustment measures with temporary salary cut of 5 % .,112,20,2
positive,"In the fourth quarter of 2009 , Orion 's net profit went up by 33.8 % year-on-year to EUR33m .",94,20,2
positive,"Mformation and Nokia noted they have established interoperability agreements that cover commercially proven , standards-based management of mobile devices , as well as mobile device security and mobile application management .",226,31,2
neutral,"As a part of the plan , the Board of Directors decided to transfer a maximum of 330,000 shares held by the company in a share issue against payment directed to Aspo Management Oy , a holding company acquired by the management .",227,43,1
positive,"`` The change will optimize the operational efficiencies of our growing business , '' said Julia Prohaska , director of marketing communications for Fiskars .",158,25,2
negative,Finnish automation solutions developer Cencorp Corporation ( OMX Helsinki : CNC1V ) issued on Thursday ( 18 September ) a profit warning for the third quarter of 2008 .,168,29,0
neutral,"Therefore , Phase III of the research will not be conducted by Abbott .",71,14,1
neutral,The shares carry a right to dividend and other shareholder rights as from their registration with the Finnish Trade Register .,126,21,1
neutral,The recruits who have completed the K-retailer trainee program are qualified to start a career as independent retailers in K-stores .,133,21,1
neutral,Nordea Bank Estonia is part of the largest financial group in the Nordic countries .,84,15,1
neutral,Swedish Wallenberg family controlled Investor has bought a large stake of C shares in Swedish retail bank SEB .,111,19,1
positive,"`` We reached agreement with the union that flights will continue as normal , '' Finnair spokesman Usko Maatta said .",117,21,2
neutral,The results will enable the preparation of a conceptual plant design and capital estimates .,92,15,1
neutral,A PLUMBING business has announced it is sponsoring a professional darts player .,80,13,1
positive,"However , sales returned to growth in April-June 2010 , CEO Pekka Eloholma said .",81,15,2
positive,"Forestries were also higher , driven by yesterday 's bullish analyst comment on Stora Enso in Dagens Industri , dealers said .",126,22,2
negative,"In this case , the effect would be negative in Finland .",56,12,0
neutral,"According to preliminary information by the Finnish Forest Industries Federation , imports of roundwood to Finland increased to about 20 million m3 in 2005 , representing an increase of 15 % from 2004 .",202,34,1
positive,"Fiskars Brands report net sales of EUR 145.8 mn , up from EUR 138.4 mn .",72,16,2
positive,It is a solid credit that has been compared to a DZ Bank or a Rabobank .,72,17,2
neutral,"Under the changes envisaged , HK Ruokatalo would reduce its number of industrial places of business in Finland from eight to six .",130,23,1
positive,"Key shareholders of Finnish IT services provider TietoEnator Oyj on Friday rejected a hostile EUR1 .08 billion $ 1.67 billion offer from buyout shop Nordic Capital , giving new life to a possible counter offer from Blackstone Group LP and Norwegian telecom Telenor ASA .",270,45,2
neutral,"Our customers include companies in the energy and process industry sectors , in particular .",92,15,1
neutral,"The transaction covers a building lot of 46,763 sq m and factory buildings of 19,631 sq m. Since the autumn of 2007 , when Scanfil discontinued its production operations in Oulu , the facilities have been partly leased to other parties .",237,42,1
neutral,"In addition , a good biological durability is achieved . ''",59,11,1
positive,Operating profit rose to EUR 5mn from EUR 2.8 mn in the fourth quarter of 2008 .,80,17,2
negative,Return on capital employed ROCE was a negative 2.3 % compared to 11.3 % in 2007 .,81,17,0
neutral,A few employees would remain at the Oulu plant in support functions for other group units .,91,17,1
neutral,The value of the orders is over EUR 10mn .,42,10,1
neutral,The annual value of the contracts is estimated at USD 2mn over the next three years .,85,17,1
neutral,`` Marimekko operates in an industry in which changes in the business climate are reflected in consumer demand .,112,19,1
positive,"Fiskars has a strong portfolio of international brands , which include Fiskars , Iittala , Gerber , Silva and Buster .",118,21,2
neutral,"Cardona slowed her vehicle , turned around and returned to the intersection , where she called 911 .",100,18,1
positive,"Nokia also noted the average selling price of handsets declined during the period , though its mobile phone profit margin rose to more than 22 percent from 13 percent in the year-ago quarter .",192,34,2
neutral,"The total restructuring costs are expected to be about EUR 30mn , of which EUR 13.5 mn was booked in December 2008 .",116,23,1
positive,Growth is expected to continue in 2008 .,40,8,2
neutral,You 're not alone .,19,5,1
neutral,"Finnish real estate investor Sponda Plc said on Wednesday 12 March that it has signed agreements with Danske Bank A-S , Helsinki Branch for a 7-year EUR150m credit facility and with Ilmarinen Mutual Pension Insurance Company for a 7-year EUR50m credit facility .",262,43,1
neutral,"Currently , 95 % of Trainers House 's revenues are attributed to the Finnish market .",85,16,1
neutral,"The orders are for 26 machine-room-less KONE MonoSpace elevators , which would be installed during 2006 .",105,17,1
neutral,The company has 120 employees and annual sales of approximately EUR16m .,72,12,1
positive,"Tiimari Latvian representative Ineta Zaharova said that the company earned LVL 122,000 in 2005 profit , which is 20 times more that in 2004 .",141,25,2
positive,"Besides we have increased the share of meat in various sausages and are offering a number of new tastes in the grill products and shish kebabs segment , '' Paavel said .",169,32,2
neutral,Cymed 's net sales are expected to amount to EUR 3.5 mn in 2006 .,65,15,1
negative,Korhonen was dismissed from her post of editor in chief of the group 's newspaper Lapin Kansa in December 2008 .,112,21,0
positive,"Finland-based Elcoteq SE , a privately held provider of electronics manufacturing services to communications companies , said Thursday it signed a long-term manufacturing supply deal with communications equipment company Andrew Corp. .",235,32,2
neutral,Finnish Civil Aviation Administration decided to temporarily reopen Finnish capital 's Helsinki airport since 3 p.m. to 11 p.m. Monday local time .,147,23,1
neutral,The value of the three-year contract is estimated at EUR40m .,61,11,1
positive,"Vaisala also said it expects net sales of EUR 253.2 million for 2010 , compared with EUR 252.2 million recorded in 2009 .",121,23,2
neutral,"Now , Nokia has announced the launch of Bicycle Charger Kit that is compatible with all Nokia phones that have a 2 mm charging interface .",138,26,1
positive,"KESKO CORPORATION STOCK EXCHANGE RELEASE 28.02.2008 AT 09.30 1 ( 1 ) Kesko Corporation and Aspo plc today signed an agreement by which Aspo acquires the share capital of Kauko-Telko Ltd , a subsidiary wholly owned by Kesko .",224,39,2
neutral,"The segments through which the company operates are Frozen Food business , Seafoods , Vegetable Oil business , Grain Trading and Other business operations .",156,25,1
neutral,"Following the issue , the new shares will constitute 10 percent of the firm 's capital .",88,17,1
positive,"`` We continued actively to focus R&D and to position our offering away from point solutions towards dynamic end-to-end solutions , '' Ervio stated .",149,25,2
positive,"For Teleste , the acquisition marks an entry into services business in a market where it has long been an established and significant supplier of products .",156,27,2
negative,"The steelmaker said that the drop in profit was explained by the continuing economic uncertainty , mixed with the current drought in bank lending , resulting in a decline in demand for its products as customers find it increasingly difficult to fund operations .",262,44,0
positive,"More than 200 volunteers from Fiskars , the garden tool company , Home Depot ( NYSE : HD ) , the city of Baltimore and the neighborhood are working right now to create a garden sanctuary - in a single day .",206,42,2
neutral,"These products include Personal Communications products such as mobile phones and their parts , Home Communications products such as set-top boxes and electronics for flat panel TVs as well as Communications Networks products such as base-stations , tower-top amplifiers , and microwave systems .",296,44,1
neutral,"The report profiles 614 companies including many key and niche players worldwide such as Black & Decker Corporation , Fiskars Corporation , Fiskars Brands , Inc. , Husqvarna Outdoor Products Inc. , K+S Group , Ryobi Technologies , Inc. , The Scotts Miracle-Gro Company , and Van Group , Inc. .",293,51,1
neutral,Net sales in 2006 totaled EUR 302 million and the operating margin was 16 % .,77,16,1
neutral,Aker Yards Finland will begin using Chinese subcontractors at its Finnish shipyards .,85,13,1
positive,Pretax profit rose to EUR 17.8 mn from EUR 14.9 mn in 2005 .,60,14,2
neutral,"The objective is that trading in the shares will commence on May 2 , 2007 .",75,16,1
neutral,The webcast may be followed online on the company website at www.ruukki.com/investors .,87,13,1
negative,The acquisition of +_landsbanken Sverige in 2009 burdened the performance with EUR 3.0 mn .,91,15,0
neutral,Basware finances the acquisition with a bank loan .,51,9,1
positive,"Olvi , which controls a 94 percent stake in Ragutis through A. Le Coq , said in its annual report published earlier this year that the Lithuanian brewery 's sales reached 15.04 million euros last year , a rise of 20.4 percent from 12.49 million euros in 2004 .",260,49,2
neutral,The adjustment measures will be carried out in phases to secure the delivery capability .,89,15,1
neutral,The energy shot is packed in a 100-millilitre bag with a screw cap .,68,14,1
neutral,"Unlisted British Biologicals makes B - and D - proteins , and other disease-specific supplements that cover diabetes , hepatitis , asthma and other cardiovascular ailments .",173,27,1
neutral,It also recovers valuable raw material for Kemira 's water chemical production .,80,13,1
positive,Finnish consumer packaging manufacturer Huhtamaki Oyj said it swung to a net profit of 84.1 mln euro $ 105.6 mln in the first nine months of 2006 from a net loss of 2.6 mln euro $ 3.3 mln in the same period of 2005 .,216,45,2
neutral,Finnish construction company Lemminkainen Oyj HEL : LEM1S said yesterday that it would build a plastic film extrusion plant for packaging materials supplier Ab Rani Plast Oy at Lemminkainen 's Kaluga industrial park in Russia .,227,36,1
neutral,Almost the entire office building will be occupied by Metso .,61,11,1
neutral,"It makes a wide range of mobile devices with services and software that enable people to experience music , navigation , video , television , imaging , games and business mobility .",181,32,1
neutral,Finnish Bank of +_land will launch its long-term pension savings account at the beginning of June 2010 .,104,18,1
neutral,"The Group 's business sectors are Building Construction , Infrastructure Construction , Technical Building Services , and Building Products .",141,20,1
positive,Finnair was able to operate most of its leisure flights despite the strike .,76,14,2
negative,The company decided at the end of 2008 to temporarily shut down its ammonia plant in Billingham and extend the maintenance period at its Ince facility .,152,27,0
negative,"UPM-Kymmene Corp. , the world 's largest maker of magazine paper , on Tuesday reported a 19-percent profit drop as lower paper prices , higher costs and a strong euro hurt revenue .",181,33,0
positive,"Previously , the company had guided for EBIT and sales growth of 20 pct and 10 pct respectively for this year .",111,22,2
positive,The company intends to raise production capacity in 2006 .,58,10,2
negative,Earnings per share EPS in 2005 decreased to EUR0 .66 from EUR1 .15 in 2004 .,76,16,0
neutral,"According to Honka Japan 's Managing Director Marko Saarelainen , Honkarakenne exports about 200 ready made log houses to Japan a year .",136,23,1
positive,"`` We are delighted to welcome Elisa to our Board of Directors , '' said Garry McGuire , CEO of RMG Networks .",110,23,2
negative,"HELSINKI AFX - Kesko Corp is expected to report a lower second quarter EPS today due to tax charges , but other earnings lines are seen higher year-on-year , analysts said .",173,32,0
neutral,"According to Soosalu , particular attention was paid to residents privacy and security in the design of the Aleksandri Street building .",136,22,1
neutral,"POYRY PLC Additional information by : Martin Kuzaj , President , Industry Business Group , Finland Tel. +358 10 33 21179 Sanna Paivaniemi , Director , Investor Relations , Poyry PLC , Finland Tel. +358 10 33 23002 Poyry is a global consulting and engineering company dedicated to balanced sustainability .",305,51,1
neutral,"Ahlstrom 's 5,800 employees serve customers via sales offices and production facilities in more than 20 countries on six continents .",133,21,1
neutral,"In total , more than 3000 surveillance cameras will be handled and managed according to a variety of needs , the company said .",127,24,1
positive,SCANIA Morgan Stanley lifted the share target on Swedish heavy-duty truck and bus maker Scania AB to 330 crowns ( $ 42.4 - 35.2 euro ) from 310 crowns ( $ 39.8 - 33.1 euro ) .,175,37,2
neutral,The organization that is a member of the Russian auto sector union MPRA has become active since Tikkurila acquired Russian paint company Kraski Teks in 2006 .,158,27,1
neutral,The shares represented 4.998 % of total share capital and 2.14 % of total voting rights .,89,17,1
positive,Net sales surged by 30 % to EUR 36 million .,44,11,2
positive,"SRV will raise its holding in the company so that by the summer of 2008 , it will have a majority .",99,22,2
neutral,The share of the share capital of both above mentioned shareholders remains below 5 % .,87,16,1
positive,"` After fixing our home-base , cutting costs and closing the non-profitable units , we are now looking at going forward , ' she said .",134,26,2
neutral,The winner does not have to be present to win .,47,11,1
positive,"Following the transaction , Lundbeck has worldwide rights for nalmefene , excluding North America , Mexico , Turkey and South-Korea .",133,21,2
neutral,"The company 's objective is to offer the best people flow experience by developing and delivering solutions that enable people to move smoothly , safely , comfortably and without waiting in buildings in an increasingly urbanizing environment .",243,38,1
positive,`` It allows the young child to move forward with his life . '',63,14,2
positive,"Uponor made an operating profit of EUR 151.0 mn , up from EUR 143.7 mn , which made 2007 a record year .",104,23,2
positive,The fair value of the company 's investment properties grew to EUR 2.803 billion at the end of March 2009 from EUR 2.691 million a year ago .,141,28,2
neutral,"India is high on our priority since business links between our two countries is also expanding , '' Tornstrom said .",116,21,1
neutral,"This rating from A.M. Best is the highest among the CIS countries , Central and Eastern Europe .",96,18,1
positive,Raute Corporation has received orders worth over EUR 12 million from OOO Ilim Bratsk DOK in Russia .,100,18,2
negative,"Compared with the FTSE 100 index , which rose 36.7 points ( or 0.6 % ) on the day , this was a relative price change of -0.2 % .",128,30,0
positive,"Both operating profit and sales for the three-month period increased , respectively from EUR0 .3 m and EUR13 .1 m , as compared to the corresponding period in 2005 .",165,30,2
positive,"Rinkuskiai raised the sales by 18.1 percent , to 1.37 million liters , while the sales of Kauno Alus grew by 14.3 percent , to 960,000 liters .",143,28,2
neutral,"The company is also seeking possibilities to relocate the Luumaki personnel , some 50 people , to other UPM mills .",115,21,1
negative,Scanfil will execute the temporary lay-offs by mid-October 2009 and the job cuts by March 2010 .,96,17,0
positive,"Then , it said the contract was estimated to contribute more than EUR150m to its net sales in 2010 .",100,20,2
neutral,"Rautalinko was resposnible also for Mobility Services , and his job in this division will be continued by Marek Hintze .",120,21,1
positive,1 November 2010 - Finnish textile and clothing company Marimekko Oyj ( HEL : MMO1V ) announced on Friday the opening of its first concept store in Seoul in cooperation with Japanese sector player Look Inc ( TYO : 8029 ) .,221,42,2
neutral,"This one was at one time targeted for June 5 , but if we had to guess , it 's been pushed back -- maybe we 're crazy , but we feel like it has n't leaked enough to meet that date at this point .",194,46,1
positive,fi is developing cooperation in keyword advertising with Microsoft .,68,10,2
neutral,"The remainder of its revenues will come from technology agreements with other firms , InterDigital said .",105,17,1
neutral,The company 's board of directors would propose a dividend of EUR0 .15 per share for 2005 .,91,18,1
neutral,"New Chairman of the Board of Directors , Mr Chaim Katzman , will give a presentation and answer questions .",107,20,1
neutral,After that the two companies sat down and sewed up the present deal .,69,14,1
neutral,"Operating profit for the six-month period decreased from EUR111 .9 m , while sales increased from EUR1 ,275 m , as compared to the corresponding period in 2006 .",161,29,1
negative,"However , the growth margin slowed down due to the financial crisis .",69,13,0
neutral,"Among the Scandinavian companies present in St. Petersburg , is also named the Swedish concern NCC , which implements projects in the field of asphalt production , road and housing construction ( project Swedish Krona ) .",221,37,1
neutral,"Solvay S.A. has engaged Poyry to provide project management , engineering , procurement , and site services for a hydrogen peroxide production plant to be built by a Solvay-BASF joint venture at BASF 's Zandvliet site , Belgium .",229,39,1
neutral,"About 36 % of this came from Aspo Chemicals , 39 % from Aspo Shipping and 25 % from Aspo Systems .",98,22,1
positive,A new Kveyt light variety of Suomalainen Pekoni marketed under the Atria brand name is now available to consumers in Finland .,126,22,2
neutral,"SRV will also build an aqua park with wellness area , a restaurant and a multifunctional ice arena .",100,19,1
positive,"According to ACNielsen 's ScanTrack study for the period week 10 of 2005 to week 9 of 2006 , Coca-Cola is the market leader in soft drinks in Finland .",151,30,2
neutral,"A downloadable instruction sheet , instructional video , and project ideas for the award-winning Everywhere Punch TM Window System can be found at www.fiskars.com .",164,25,1
negative,The company initially estimated that it would cut up to 30 jobs .,65,13,0
neutral,"Tip of the week Panfish like bluegills are great fun to catch , especially for children new to fishing .",104,20,1
neutral,The company 's share is quoted on NASDAQ OMX Helsinki Rautaruukki Oyj : RTRKS .,79,15,1
neutral,The use case dramatically narrows if you go only with the hot s Ltd.,68,14,1
neutral,Technopolis has approximately 130 customer companies in Jyvaskyla .,67,9,1
neutral,Russia 's Video International Group holds a controlling stake in Russian Media Ventures .,89,14,1
neutral,Closing of such transaction took place today .,46,8,1
neutral,hu will offer a further discount of between 25 % and 50 % on selected books .,77,17,1
positive,"Significance : Teleste has emphasised that with its large size and growing economy , as well as the rapid development of its TV services distribution industry , Poland is viewed as an attractive market .",203,35,2
negative,Operating profit fell to EUR 20.3 mn from EUR 74.2 mn in the second quarter of 2008 .,85,18,0
neutral,"We now have both the opportunity and the responsibility to create a new journalistic culture to serve the readers of Alma Media 's newspapers , `` says Hannu Ollikainen , head of the new Helsinki desk .",202,37,1
neutral,Finnish property investment company Citycon plans to issue directed subordinated convertible bonds to institutional investors .,127,16,1
neutral,"With Aldata , we can help retailers ensure that their merchandising and selections reflect customer demand and their evolving shopping behavior . ''",148,23,1
neutral,The category was marked by maturity and the recession .,55,10,1
neutral,Terms of the acquisition were not disclosed .,45,8,1
neutral,"The total size of the complex is around 25,000 m2 and the project will be constructed in stages .",97,19,1
neutral,"The company 's board of directors will propose a dividend of EUR 0.95 per share for 2008 at the annual general meeting , scheduled to be held on March 23 , 2009 .",162,33,1
neutral,"The dividend is payable on February 1 , 2010 to shareholders of record on January 19 , 2010 .",93,19,1
neutral,"The Daily Graphic newspaper , in October , reported an initiative being embarked upon by the Fidelity Bank to partner Ghana Post , which has offices across the country , to offer financial services to the unbanked and under-banked in the country .",247,43,1
neutral,All are welcome .,17,4,1
negative,Comparable operating profit decreased to EUR 13.8 mn from EUR 17.1 mn in the corresponding period in 2005 .,107,19,0
neutral,"Tulikivi manufactures heat-retaining , soapstone and ceramic fireplaces , as well as natural stone products and utility ceramics .",130,19,1
neutral,The appointments will be in force until the new CEO has been appointed .,72,14,1
neutral,The order for plywood mill machinery and equipment announced by Finnish Raute in September 2006 will be delivered to Thebault Plyland in France .,145,24,1
negative,Asian traffic declined by 3.4 per cent .,40,8,0
neutral,It said Comptel delivers reliable provisioning and activation solutions which improve fulfilment processes for operators .,122,16,1
neutral,"After the signing , the total amount of Aspo 's revolving credit facility agreements is EUR 50 million , which replaces the formerly valid agreements of EUR 80 million .",169,30,1
neutral,"The program included operational improvements and reductions in personnel , mainly in the Netherlands .",103,15,1
positive,"It rose by 15.7 % and by 24.8 % in Finland and abroad , respectively , to EUR 7 million and EUR 4.2 million , due to a 40 % growth in Russia .",142,34,2
positive,"Net income from life insurance rose to EUR 16.5 mn from EUR 14.0 mn , and net income from non-life insurance to EUR 22.6 mn from EUR 15.2 mn in 2009 .",150,32,2
neutral,"After the transaction , Herttaassa 's holding in Alma Media has fallen below the flagging limit of 5 % .",104,20,1
neutral,28 January 2011 - Finnish technology center operator Technopolis Oyj (HEL : TPS1V)said today it will invest EUR22 .5 m in the construction of the second phase of an office facility in Tampere .,193,34,1
positive,"In Lithuania , operating profit rose to EUR 190,000 from EUR 70,000 in the corresponding period in 2005 .",105,19,2
negative,"Sales in Finland decreased by 10.5 % in January , while sales outside Finland dropped by 17 % .",95,19,0
neutral,"CapMan , the Stockholm-headquartered private equity firm , has held a first close on its second private equity real estate fund as it continues its push into the property sector .",179,31,1
